{
  "schema_version": "1.0.0",
  "event_type": "command_attempt_audit",
  "audit_sequence": 3,
  "audit_event_id": "audit.command.cancel.001",
  "project_id": "project.demo",
  "action_type": "cancel_run",
  "target": {
    "target_type": "run_cancellation",
    "run_id": "run.p3.theory.20260802t140000z",
    "expected_state": "running",
    "expected_last_event_sequence": 4,
    "expected_journal_root_sha256": "8184ded221612977253015d00b6b01d5fa78341349a4a0cc25f8da86ca6d64b5"
  },
  "raw_request": {
    "artifact_id": "artifact.command.request.run.cancel.001",
    "uri": "artifact://project.demo/command-requests/command.run.cancel.001.json",
    "sha256": "43fb660dc3b87a0ba27c4fe6bdd0bf1df9e5123d88081f18eb3b8beb37d01dab",
    "media_type": "application/json",
    "byte_length": 922
  },
  "validated_command": {
    "command_id": "command.run.cancel.001",
    "command_sha256": "5d1815ee03229f6405fbae34c98a5ed297b5c5e7c753517d385fd29d0c0c6348"
  },
  "requested_by": {
    "user_id": "researcher.demo",
    "operating_actor_type": "authorized_remote_operator",
    "operator_id": "operator.hermes.demo"
  },
  "check_stage": "pre_commit",
  "authorization": {
    "decision": "authorized",
    "authentication_check": "passed",
    "delegation_check": {
      "grant_id": "delegation.research.operator.001",
      "grant_sha256": "8a34fa67a83bdb8f20478d511fc9c4ccb29d4ace5ad5ceebedce9da883faed24",
      "project_scope_check": "passed",
      "action_scope_check": "passed",
      "target_scope_check": "passed",
      "time_window_check": "passed",
      "revocation_check": "passed"
    }
  },
  "result": {
    "status": "accepted",
    "effect_ref": {
      "effect_kind": "run_state_event",
      "effect_id": "event.cancel.requested.001",
      "effect_sha256": "46adc8d898393e678216ba447bc6622dfc9888a939ab0da5d487c3d7fd92871f"
    }
  },
  "occurred_at": "2026-08-02T14:20:00Z",
  "prior_audit_root_sha256": "b88fb999b2b4aa7d86be66ae54ac7851d77c378fede1a048df736ed0a412f151",
  "content_sha256": "524baedd8b4b0b622faf88dcff940089a0d61d3110a3b2b21879593223efdadb",
  "audit_root_sha256": "452fdfdd19bccffb7217a3ba47d09d7a1debaec27d85a598df68c1963220f797"
}
